Sheet: Sheet1
A1: 128 | L1: относительное время работы | R1: во колько раз ускорено
A2: 1 | B2: 5 | C2: =RC[-1]/R2C2 -> 1 | F2: 5 | G2: 30 | H2: 243 | I2: 2016 | J2: 94569 | L2: 1 | M2: 1 | N2: 1 | O2: 1 | P2: 1 | R2: =1/RC[-6] -> 1 | S2: =1/RC[-6] -> 1 | T2: =1/RC[-6] -> 1 | U2: =1/RC[-6] -> 1 | V2: =1/RC[-6] -> 1
A3: 2 | B3: 3 | C3: =RC[-1]/R2C2 -> 0.6 | F3: 3 | G3: 16 | H3: 138 | I3: 1516 | J3: 60029 | L3: 0.6 | M3: 0.53333333333333333 | N3: 0.5679012345679012 | O3: 0.75198412698412698 | P3: 0.63476403472596732 | R3: =1/RC[-6] -> 1.6666666666666667 | S3: =1/RC[-6] -> 1.875 | T3: =1/RC[-6] -> 1.7608695652173914 | U3: =1/RC[-6] -> 1.3298153034300793 | V3: =1/RC[-6] -> 1.5753885621949391
A4: 4 | B4: 1 | C4: =RC[-1]/R2C2 -> 0.2 | F4: 1 | G4: 5 | H4: 87 | I4: 737 | J4: 35264 | L4: 0.2 | M4: 0.16666666666666666 | N4: 0.35802469135802467 | O4: 0.3655753968253968 | P4: 0.3728917509966268 | R4: =1/RC[-6] -> 5 | S4: =1/RC[-6] -> 6 | T4: =1/RC[-6] -> 2.7931034482758621 | U4: =1/RC[-6] -> 2.7354138398914518 | V4: =1/RC[-6] -> 2.6817434210526314
A5: 8 | B5: 2 | C5: =RC[-1]/R2C2 -> 0.4 | F5: 2 | G5: 7 | H5: 86 | I5: 684 | J5: 29667 | L5: 0.4 | M5: 0.23333333333333334 | N5: 0.35390946502057613 | O5: 0.3392857142857143 | P5: 0.31370745170193193 | R5: =1/RC[-6] -> 2.5 | S5: =1/RC[-6] -> 4.2857142857142856 | T5: =1/RC[-6] -> 2.8255813953488373 | U5: =1/RC[-6] -> 2.9473684210526314 | V5: =1/RC[-6] -> 3.1876832844574778
A6: 16 | B6: 2 | C6: =RC[-1]/R2C2 -> 0.4 | F6: 2 | G6: 4 | H6: 80 | I6: 651 | J6: 30214 | L6: 0.4 | M6: 0.13333333333333333 | N6: 0.32921810699588477 | O6: 0.32291666666666669 | P6: 0.31949158815256584 | R6: =1/RC[-6] -> 2.5 | S6: =1/RC[-6] -> 7.5 | T6: =1/RC[-6] -> 3.0375000000000001 | U6: =1/RC[-6] -> 3.096774193548387 | V6: =1/RC[-6] -> 3.1299728602634542
A7: 32 | B7: 5 | C7: =RC[-1]/R2C2 -> 1 | F7: 5 | G7: 4 | H7: 77 | I7: 656 | J7: 29505 | L7: 1 | M7: 0.13333333333333333 | N7: 0.3168724279835391 | O7: 0.32539682539682541 | P7: 0.31199441677505313 | R7: =1/RC[-6] -> 1 | S7: =1/RC[-6] -> 7.5 | T7: =1/RC[-6] -> 3.1558441558441559 | U7: =1/RC[-6] -> 3.0731707317073171 | V7: =1/RC[-6] -> 3.2051855617691918
A8: 64 | B8: 8 | C8: =RC[-1]/R2C2 -> 1.6 | F8: 8 | G8: 5 | H8: 81 | I8: 639 | J8: 28865 | L8: 1.6 | M8: 0.16666666666666666 | N8: 0.33333333333333331 | O8: 0.3169642857142857 | P8: 0.30522687138491472 | R8: =1/RC[-6] -> 0.625 | S8: =1/RC[-6] -> 6 | T8: =1/RC[-6] -> 3 | U8: =1/RC[-6] -> 3.154929577464789 | V8: =1/RC[-6] -> 3.2762515156764249
A9: 256 | G9: 6 | H9: 81 | I9: 724 | J9: 28276 | M9: 0.2 | N9: 0.33333333333333331 | O9: 0.35912698412698413 | P9: 0.29899861476805295 | S9: =1/RC[-6] -> 5 | T9: =1/RC[-6] -> 3 | U9: =1/RC[-6] -> 2.7845303867403315 | V9: =1/RC[-6] -> 3.3444971000141464
A10: 1 | B10: 30 | C10: =RC[-1]/R10C2 -> 1 | H10: 82 | I10: 650 | J10: 27997 | N10: 0.33744855967078191 | O10: 0.32242063492063494 | P10: 0.29604838794953947 | T10: =1/RC[-6] -> 2.9634146341463414 | U10: =1/RC[-6] -> 3.1015384615384614 | V10: =1/RC[-6] -> 3.3778261956638214
A11: 2 | B11: 16 | C11: =RC[-1]/R10C2 -> 0.53333333333333333 | I11: 640 | J11: 28260 | O11: 0.31746031746031744 | P11: 0.29882942613329949 | U11: =1/RC[-6] -> 3.1500000000000004 | V11: =1/RC[-6] -> 3.3463906581740979
A12: 4 | B12: 5 | C12: =RC[-1]/R10C2 -> 0.16666666666666666 | J12: 28030 | P12: 0.29639733950871849 | V12: =1/RC[-6] -> 3.3738494470210489
A13: 8 | B13: 7 | C13: =RC[-1]/R10C2 -> 0.23333333333333334 | R13: =MAX(R[-11]C:R[-1]C) -> 5 | S13: =MAX(R[-11]C:R[-1]C) -> 7.5 | T13: =MAX(R[-11]C:R[-1]C) -> 3.1558441558441559 | U13: =MAX(R[-11]C:R[-1]C) -> 3.154929577464789 | V13: =MAX(R[-11]C:R[-1]C) -> 3.3778261956638214
A14: 16 | B14: 4 | C14: =RC[-1]/R10C2 -> 0.13333333333333333
A15: 32 | B15: 4 | C15: =RC[-1]/R10C2 -> 0.13333333333333333
A16: 64 | B16: 5 | C16: =RC[-1]/R10C2 -> 0.16666666666666666
A17: 128 | B17: 6 | C17: =RC[-1]/R10C2 -> 0.2
A18: 512
A19: 1 | B19: 243 | C19: =RC[-1]/R19C2 -> 1
A20: 2 | B20: 138 | C20: =RC[-1]/R19C2 -> 0.5679012345679012
A21: 4 | B21: 87 | C21: =RC[-1]/R19C2 -> 0.35802469135802467
A22: 8 | B22: 86 | C22: =RC[-1]/R19C2 -> 0.35390946502057613
A23: 16 | B23: 80 | C23: =RC[-1]/R19C2 -> 0.32921810699588477
A24: 32 | B24: 77 | C24: =RC[-1]/R19C2 -> 0.3168724279835391
A25: 64 | B25: 81 | C25: =RC[-1]/R19C2 -> 0.33333333333333331
A26: 128 | B26: 81 | C26: =RC[-1]/R19C2 -> 0.33333333333333331
A27: 256 | B27: 82 | C27: =RC[-1]/R19C2 -> 0.33744855967078191
A28: 1024
A29: 1 | B29: 2016 | C29: =RC[-1]/R29C2 -> 1
A30: 2 | B30: 1516 | C30: =RC[-1]/R29C2 -> 0.75198412698412698
A31: 4 | B31: 737 | C31: =RC[-1]/R29C2 -> 0.3655753968253968
A32: 8 | B32: 684 | C32: =RC[-1]/R29C2 -> 0.3392857142857143
A33: 16 | B33: 651 | C33: =RC[-1]/R29C2 -> 0.32291666666666669
A34: 32 | B34: 656 | C34: =RC[-1]/R29C2 -> 0.32539682539682541
A35: 64 | B35: 639 | C35: =RC[-1]/R29C2 -> 0.3169642857142857
A36: 128 | B36: 724 | C36: =RC[-1]/R29C2 -> 0.35912698412698413
A37: 256 | B37: 650 | C37: =RC[-1]/R29C2 -> 0.32242063492063494
A38: 512 | B38: 640 | C38: =RC[-1]/R29C2 -> 0.31746031746031744
A39: 2048
A40: 1 | B40: 94569 | C40: =RC[-1]/R40C2 -> 1
A41: 2 | B41: 60029 | C41: =RC[-1]/R40C2 -> 0.63476403472596732
A42: 4 | B42: 35264 | C42: =RC[-1]/R40C2 -> 0.3728917509966268
A43: 8 | B43: 29667 | C43: =RC[-1]/R40C2 -> 0.31370745170193193
A44: 16 | B44: 30214 | C44: =RC[-1]/R40C2 -> 0.31949158815256584
A45: 32 | B45: 29505 | C45: =RC[-1]/R40C2 -> 0.31199441677505313
A46: 64 | B46: 28865 | C46: =RC[-1]/R40C2 -> 0.30522687138491472
A47: 128 | B47: 28276 | C47: =RC[-1]/R40C2 -> 0.29899861476805295
A48: 256 | B48: 27997 | C48: =RC[-1]/R40C2 -> 0.29604838794953947
A49: 512 | B49: 28260 | C49: =RC[-1]/R40C2 -> 0.29882942613329949
A50: 1024 | B50: 28030 | C50: =RC[-1]/R40C2 -> 0.29639733950871849